{
  "raceId": "2026-au",
  "timeZone": "Australia/Melbourne",
  "dates": [
    "2026-03-06",
    "2026-03-07",
    "2026-03-08"
  ],
  "sessions": [
    {
      "id": "fp1",
      "start": "2026-03-06T01:30:00.000Z"
    },
    {
      "id": "fp2",
      "start": "2026-03-06T05:00:00.000Z"
    },
    {
      "id": "fp3",
      "start": "2026-03-07T01:30:00.000Z"
    },
    {
      "id": "qualifying",
      "start": "2026-03-07T05:00:00.000Z"
    },
    {
      "id": "race",
      "start": "2026-03-08T04:00:00.000Z"
    }
  ],
  "scheduleUrl": "https://www.formula1.com/en/racing/2026/australia",
  "scheduleRetrievedAt": "2026-10-22T08:27:26.810Z",
  "weather": {
    "kind": "archived-forecast",
    "retrievedAt": "2026-10-22T08:27:26.810Z",
    "latitude": -37.845938767123286,
    "longitude": 144.9703602671233,
    "sourceUrl": "https://historical-forecast-api.open-meteo.com/v1/forecast?latitude=-37.845938767123286&longitude=144.9703602671233&timezone=Australia%2FMelbourne&start_date=2026-03-06&end_date=2026-03-08&daily=weather_code%2Ctemperature_2m_max%2Ctemperature_2m_min%2Crelative_humidity_2m_mean%2Cprecipitation_probability_max",
    "days": [
      {
        "date": "2026-03-06",
        "code": 51,
        "highC": 22.8,
        "lowC": 13.2,
        "humidityPct": 80,
        "rainChancePct": 0
      },
      {
        "date": "2026-03-07",
        "code": 51,
        "highC": 20.8,
        "lowC": 16.3,
        "humidityPct": 74,
        "rainChancePct": 6
      },
      {
        "date": "2026-03-08",
        "code": 3,
        "highC": 24.8,
        "lowC": 14.7,
        "humidityPct": 67,
        "rainChancePct": 0
      }
    ]
  }
}
